{
  "$schema": "https://json-schema.org/draft/2020-12/schema",
  "$id": "https://example.org/avsafe/hf_avc/case.schema.json",
  "title": "HF-AVC Case",
  "type": "object",
  "required": [
    "id",
    "title"
  ],
  "properties": {
    "id": {
      "type": "string"
    },
    "title": {
      "type": "string"
    },
    "country": {
      "type": [
        "string",
        "null"
      ]
    },
    "period": {
      "type": [
        "string",
        "null"
      ]
    },
    "modalities": {
      "type": "array",
      "items": {
        "type": "string"
      }
    },
    "description": {
      "type": [
        "string",
        "null"
      ]
    },
    "reported_effects": {
      "type": "array",
      "items": {
        "type": "string"
      }
    },
    "descriptors": {
      "type": "object",
      "properties": {
        "laeq_bucket_db": {
          "type": [
            "string",
            "null"
          ]
        },
        "spectral_notes": {
          "type": [
            "string",
            "null"
          ]
        },
        "tlm_freq_hz": {
          "type": [
            "string",
            "null"
          ]
        },
        "tlm_mod_percent": {
          "type": [
            "string",
            "null"
          ]
        },
        "notes": {
          "type": [
            "string",
            "null"
          ]
        }
      },
      "additionalProperties": false
    },
    "legal_ethics": {
      "type": "object",
      "properties": {
        "uncat": {
          "type": [
            "string",
            "null"
          ]
        },
        "echr_article_3": {
          "type": [
            "string",
            "null"
          ]
        },
        "istanbul_protocol_refs": {
          "type": "array",
          "items": {
            "type": "string"
          }
        },
        "cases_cited": {
          "type": "array",
          "items": {
            "type": "string"
          }
        }
      },
      "additionalProperties": false
    },
    "sources": {
      "type": "array",
      "items": {
        "type": "object",
        "required": [
          "id",
          "title",
          "year"
        ],
        "properties": {
          "id": {
            "type": "string"
          },
          "title": {
            "type": "string"
          },
          "year": {
            "type": "integer"
          },
          "url": {
            "type": [
              "string",
              "null"
            ],
            "format": "uri"
          },
          "publisher": {
            "type": [
              "string",
              "null"
            ]
          },
          "doc_type": {
            "type": [
              "string",
              "null"
            ]
          },
          "provenance": {
            "type": [
              "string",
              "null"
            ]
          }
        },
        "additionalProperties": false
      }
    }
  },
  "additionalProperties": false
}