{
  "id": "case:unique_id",
  "title": "Short descriptive title",
  "country": "COUNTRY",
  "period": "YYYY\u2013YYYY",
  "modalities": [
    "audio",
    "light"
  ],
  "description": "Neutral, sourced summary (no sensational detail).",
  "reported_effects": [
    "sleep disruption",
    "distress"
  ],
  "descriptors": {
    "laeq_bucket_db": "55\u201370",
    "spectral_notes": "125\u2013500 Hz emphasis",
    "tlm_freq_hz": "100\u2013120",
    "tlm_mod_percent": "10\u201340",
    "notes": "Uncertainty bands, triangulated from sources."
  },
  "legal_ethics": {
    "uncat": "torture/ill-treatment (context dependent)",
    "echr_article_3": "potential relevance",
    "istanbul_protocol_refs": [],
    "cases_cited": []
  },
  "sources": [
    {
      "id": "src:short_id",
      "title": "Title",
      "year": 2000,
      "url": "https://example.org",
      "publisher": "Org",
      "doc_type": "report",
      "provenance": "archive/journal"
    }
  ]
}