{
  "id": "case:example_waco_summary",
  "title": "Siege loudspeaker operations (summary example)",
  "country": "USA",
  "period": "1993",
  "modalities": [
    "audio"
  ],
  "description": "Illustrative example record (safe abstraction). Reports mention continuous loud music and announcements.",
  "reported_effects": [
    "sleep disruption",
    "distress"
  ],
  "descriptors": {
    "laeq_bucket_db": "65-80",
    "spectral_notes": "broadband + music; emphasis 125\u2013500 Hz",
    "notes": "Proxy ranges reflect uncertainty; archival triangulation required."
  },
  "legal_ethics": {
    "uncat": "ill-treatment (context-dependent)",
    "echr_article_3": null,
    "istanbul_protocol_refs": [
      "measurement checklist"
    ],
    "cases_cited": []
  },
  "sources": [
    {
      "id": "src:press_example",
      "title": "Contemporary reporting (placeholder)",
      "year": 1993,
      "url": "https://example.org/article",
      "publisher": "Press",
      "doc_type": "article",
      "provenance": "Press clipping"
    }
  ]
}